{
  "schema_version": "0.1.0",
  "event_id": "dddddddd-dddd-4ddd-8ddd-dddddddddddd",
  "event_type": "ai_job.completed",
  "occurred_at": "2026-07-31T12:00:02Z",
  "trace_id": "trace-slice1-example-001",
  "payload": {
    "job_id": "aaaaaaaa-aaaa-4aaa-8aaa-aaaaaaaaaaaa",
    "conversation_id": "22222222-2222-4222-8222-222222222222",
    "requester_user_id": "33333333-3333-4333-8333-333333333333",
    "message_id": "11111111-1111-4111-8111-111111111111",
    "status": "completed",
    "error_code": null
  }
}
